wave,var_name,label,var_lower,label_lower
W7,R07_AX0307S_05,R07_AX0307S_05: Considered switching from smokeless tobacco to cigarillos,r07_ax0307s_05,r07_ax0307s_05: considered switching from smokeless tobacco to cigarillos
W7,R07_AX0307S_06,R07_AX0307S_06: Considered switching from smokeless tobacco to filtered cigars,r07_ax0307s_06,r07_ax0307s_06: considered switching from smokeless tobacco to filtered cigars
W7,R07_AX0307S_07,R07_AX0307S_07: Considered switching from smokeless tobacco to pipes,r07_ax0307s_07,r07_ax0307s_07: considered switching from smokeless tobacco to pipes
W7,R07_AX0307S_08,R07_AX0307S_08: Considered switching from smokeless tobacco to hookahs,r07_ax0307s_08,r07_ax0307s_08: considered switching from smokeless tobacco to hookahs
W7,R07_AX0307S_09,R07_AX0307S_09: Considered switching from smokeless tobacco to snus,r07_ax0307s_09,r07_ax0307s_09: considered switching from smokeless tobacco to snus
W7,R07_AX0307S_11,R07_AX0307S_11: Considered switching from smokeless tobacco to IQOS,r07_ax0307s_11,r07_ax0307s_11: considered switching from smokeless tobacco to iqos
W7,R07_AX0307S_12,R07_AX0307S_12: Considered switching from smokeless tobacco to nicotine pouches,r07_ax0307s_12,r07_ax0307s_12: considered switching from smokeless tobacco to nicotine pouches
W7,R07_AX0307S_13,R07_AX0307S_13: Considered switching from smokeless tobacco to other types of or,r07_ax0307s_13,r07_ax0307s_13: considered switching from smokeless tobacco to other types of or
W7,R07_AX0307Q_01,R07_AX0307Q_01: Have not considered switching from IQOS to another product,r07_ax0307q_01,r07_ax0307q_01: have not considered switching from iqos to another product
W7,R07_AX0307Q_02,R07_AX0307Q_02: Considered switching from IQOS to cigarettes,r07_ax0307q_02,r07_ax0307q_02: considered switching from iqos to cigarettes
W7,R07_AX0307Q_03,R07_AX0307Q_03: Considered switching from IQOS to e-cigarettes or other electron,r07_ax0307q_03,r07_ax0307q_03: considered switching from iqos to e-cigarettes or other electron
W7,R07_AX0307Q_04,R07_AX0307Q_04: Considered switching from IQOS to traditional cigars,r07_ax0307q_04,r07_ax0307q_04: considered switching from iqos to traditional cigars
W7,R07_AX0307Q_05,R07_AX0307Q_05: Considered switching from IQOS to cigarillos,r07_ax0307q_05,r07_ax0307q_05: considered switching from iqos to cigarillos
W7,R07_AX0307Q_06,R07_AX0307Q_06: Considered switching from IQOS to filtered cigars,r07_ax0307q_06,r07_ax0307q_06: considered switching from iqos to filtered cigars
W7,R07_AX0307Q_07,R07_AX0307Q_07: Considered switching from IQOS to pipes,r07_ax0307q_07,r07_ax0307q_07: considered switching from iqos to pipes
W7,R07_AX0307Q_08,R07_AX0307Q_08: Considered switching from IQOS to hookahs,r07_ax0307q_08,r07_ax0307q_08: considered switching from iqos to hookahs
W7,R07_AX0307Q_09,R07_AX0307Q_09: Considered switching from IQOS to snus,r07_ax0307q_09,r07_ax0307q_09: considered switching from iqos to snus
W7,R07_AX0307Q_10,R07_AX0307Q_10: Considered switching from IQOS to smokeless tobacco,r07_ax0307q_10,r07_ax0307q_10: considered switching from iqos to smokeless tobacco
W7,R07_AX0307Q_12,R07_AX0307Q_12: Considered switching from IQOS to nicotine pouches,r07_ax0307q_12,r07_ax0307q_12: considered switching from iqos to nicotine pouches
W7,R07_AX0307Q_13,R07_AX0307Q_13: Considered switching from IQOS to other types of oral nicotine p,r07_ax0307q_13,r07_ax0307q_13: considered switching from iqos to other types of oral nicotine p
W7,R07_AN0010E,R07_AN0010E: Consider yourself to be addicted to electronic nicotine products,r07_an0010e,r07_an0010e: consider yourself to be addicted to electronic nicotine products
W7,R07_AN0015E,R07_AN0015E: Has strong cravings to use electronic nicotine products,r07_an0015e,r07_an0015e: has strong cravings to use electronic nicotine products
W7,R07_AN0020E,R07_AN0020E: Ever felt like you really needed to use electronic nicotine product,r07_an0020e,r07_an0020e: ever felt like you really needed to use electronic nicotine product
W7,R07_AN0055E,R07_AN0055E: Level of agreement: Finds self reaching for electronic nicotine pro,r07_an0055e,r07_an0055e: level of agreement: finds self reaching for electronic nicotine pro
W7,R07_AN0025E_RANDOM_01,R07_AN0025E_RANDOM_01: AN0025E series random question 1,r07_an0025e_random_01,r07_an0025e_random_01: an0025e series random question 1
W7,R07_AN0025E_RANDOM_02,R07_AN0025E_RANDOM_02: AN0025E series random question 2,r07_an0025e_random_02,r07_an0025e_random_02: an0025e series random question 2
W7,R07_AN0025E_RANDOM_03,R07_AN0025E_RANDOM_03: AN0025E series random question 3,r07_an0025e_random_03,r07_an0025e_random_03: an0025e series random question 3
W7,R07_AN0025E_RANDOM_04,R07_AN0025E_RANDOM_04: AN0025E series random question 4,r07_an0025e_random_04,r07_an0025e_random_04: an0025e series random question 4
W7,R07_AN0025E_RANDOM_05,R07_AN0025E_RANDOM_05: AN0025E series random question 5,r07_an0025e_random_05,r07_an0025e_random_05: an0025e series random question 5
W7,R07_AN0025E_RANDOM_06,R07_AN0025E_RANDOM_06: AN0025E series random question 6,r07_an0025e_random_06,r07_an0025e_random_06: an0025e series random question 6
W7,R07_AN0025E_RANDOM_07,R07_AN0025E_RANDOM_07: AN0025E series random question 7,r07_an0025e_random_07,r07_an0025e_random_07: an0025e series random question 7
W7,R07_AN0025E_RANDOM_08,R07_AN0025E_RANDOM_08: AN0025E series random question 8,r07_an0025e_random_08,r07_an0025e_random_08: an0025e series random question 8
W7,R07_AN0025E_RANDOM_09,R07_AN0025E_RANDOM_09: AN0025E series random question 9,r07_an0025e_random_09,r07_an0025e_random_09: an0025e series random question 9
W7,R07_AN0025E_RANDOM_10,R07_AN0025E_RANDOM_10: AN0025E series random question 10,r07_an0025e_random_10,r07_an0025e_random_10: an0025e series random question 10
W7,R07_AN0025E_RANDOM_11,R07_AN0025E_RANDOM_11: AN0025E series random question 11,r07_an0025e_random_11,r07_an0025e_random_11: an0025e series random question 11
W7,R07_AN0025E_RANDOM_12,R07_AN0025E_RANDOM_12: AN0025E series random question 12,r07_an0025e_random_12,r07_an0025e_random_12: an0025e series random question 12
W7,R07_AN0025E_RANDOM_13,R07_AN0025E_RANDOM_13: AN0025E series random question 13,r07_an0025e_random_13,r07_an0025e_random_13: an0025e series random question 13
W7,R07_AN0025E_RANDOM_14,R07_AN0025E_RANDOM_14: AN0025E series random question 14,r07_an0025e_random_14,r07_an0025e_random_14: an0025e series random question 14
W7,R07_AN0025E_RANDOM_15,R07_AN0025E_RANDOM_15: AN0025E series random question 15,r07_an0025e_random_15,r07_an0025e_random_15: an0025e series random question 15
W7,R07_AN0025E,R07_AN0025E: Level of agreement: Frequently crave electronic nicotine products,r07_an0025e,r07_an0025e: level of agreement: frequently crave electronic nicotine products
W7,R07_AN0030E,R07_AN0030E: Level of agreement: Urges keep getting stronger if don't/still have,r07_an0030e,r07_an0030e: level of agreement: urges keep getting stronger if don't/still have
W7,R07_AN0035E,R07_AN0035E: Level of agreement: Electronic nicotine products control me,r07_an0035e,r07_an0035e: level of agreement: electronic nicotine products control me
W7,R07_AN0045E,R07_AN0045E: Level of agreement: My electronic nicotine product use is out of co,r07_an0045e,r07_an0045e: level of agreement: my electronic nicotine product use is out of co
W7,R07_AN0060E,R07_AN0060E: Level of agreement: Usually want to use electronic nicotine product,r07_an0060e,r07_an0060e: level of agreement: usually want to use electronic nicotine product
W7,R07_AN0065E,R07_AN0065E: Level of agreement: Can only go a couple of hours without using ele,r07_an0065e,r07_an0065e: level of agreement: can only go a couple of hours without using ele
W7,R07_AN0050E,R07_AN0050E: Level of agreement: Frequently use electronic nicotine products wit,r07_an0050e,r07_an0050e: level of agreement: frequently use electronic nicotine products wit
W7,R07_AN0070E,R07_AN0070E: Level of agreement: Using electronic nicotine products really helps,r07_an0070e,r07_an0070e: level of agreement: using electronic nicotine products really helps
W7,R07_AN0075E,R07_AN0075E: Level of agreement: Using electronic nicotine products helps me thi,r07_an0075e,r07_an0075e: level of agreement: using electronic nicotine products helps me thi
W7,R07_AN0255E,R07_AN0255E: Level of agreement: Most people I spend time with are tobacco users,r07_an0255e,r07_an0255e: level of agreement: most people i spend time with are tobacco users
W7,R07_AN0080E,R07_AN0080E: Level of agreement: Would feel alone without my electronic nicotine,r07_an0080e,r07_an0080e: level of agreement: would feel alone without my electronic nicotine
W7,R07_AN0085E,R07_AN0085E: Level of agreement: Would find it really hard to stop using electro,r07_an0085e,r07_an0085e: level of agreement: would find it really hard to stop using electro
W7,R07_AN0090E,R07_AN0090E: Level of agreement: Would find it hard to stop using electronic nic,r07_an0090e,r07_an0090e: level of agreement: would find it hard to stop using electronic nic
W7,R07_AN0095E,"R07_AN0095E: Level of agreement: After not using e-cigarettes for a while, need",r07_an0095e,"r07_an0095e: level of agreement: after not using e-cigarettes for a while, need"
W7,R07_AN0100E,"R07_AN0100E: Level of agreement: After not using e-cigarettes for a while, need",r07_an0100e,"r07_an0100e: level of agreement: after not using e-cigarettes for a while, need"
W7,R07_AN0110E,R07_AN0110E: Do you believe that using electronic nicotine products is causing/c,r07_an0110e,r07_an0110e: do you believe that using electronic nicotine products is causing/c
W7,R07_AN0813E,"R07_AN0813E: In past 12 months, found it difficult to keep from using electronic",r07_an0813e,"r07_an0813e: in past 12 months, found it difficult to keep from using electronic"
W7,R07_AN0812E,"R07_AN0812E: In past 12 months, gave up or cut down on activities that were enjo",r07_an0812e,"r07_an0812e: in past 12 months, gave up or cut down on activities that were enjo"
W7,R07_AN0105E,R07_AN0105E: Have you tried to quit electronic nicotine products in the past 12,r07_an0105e,r07_an0105e: have you tried to quit electronic nicotine products in the past 12
W7,R07_AN0334E,"R07_AN0334E: In the past 12 months, tried to quit by gradually cutting back on u",r07_an0334e,"r07_an0334e: in the past 12 months, tried to quit by gradually cutting back on u"
W7,R07_AN0115E,"R07_AN0115E: In past 12 months, number of times tried to quit using electronic n",r07_an0115e,"r07_an0115e: in past 12 months, number of times tried to quit using electronic n"
W7,R07_AN0120E,"R07_AN0120E: In past 12 months, stopped using electronic nicotine products for o",r07_an0120e,"r07_an0120e: in past 12 months, stopped using electronic nicotine products for o"
W7,R07_AN0125E,"R07_AN0125E: In past 12 months, how many times you stopped using electronic nico",r07_an0125e,"r07_an0125e: in past 12 months, how many times you stopped using electronic nico"
W7,R07_AN0256E,"R07_AN0256E: In past 12 months, stopped using electronic nicotine products more",r07_an0256e,"r07_an0256e: in past 12 months, stopped using electronic nicotine products more"
W7,R07_AN0130E_NN,"R07_AN0130E_NN: In past 12 months, length of time you stopped using electronic n",r07_an0130e_nn,"r07_an0130e_nn: in past 12 months, length of time you stopped using electronic n"
W7,R07_AN0130E_UN,"R07_AN0130E_UN: In past 12 months, length of time you stopped using electronic n",r07_an0130e_un,"r07_an0130e_un: in past 12 months, length of time you stopped using electronic n"
W7,R07_AN0300E,"R07_AN0300E: In past 12 months, length of time stopped using electronic nicotine",r07_an0300e,"r07_an0300e: in past 12 months, length of time stopped using electronic nicotine"
W7,R07_AN0135E,R07_AN0135E: Approximate end date of last electronic nicotine product quit attem,r07_an0135e,r07_an0135e: approximate end date of last electronic nicotine product quit attem
W7,R07_AN0135E_VALUE_INFO,R07_AN0135E_VALUE_INFO: Type of response provided for R07_AN0135E,r07_an0135e_value_info,r07_an0135e_value_info: type of response provided for r07_an0135e
W7,R07_AN0140E,"R07_AN0140E: In past 12 months, was the duration of last quit attempt reported t",r07_an0140e,"r07_an0140e: in past 12 months, was the duration of last quit attempt reported t"
W7,R07_AN0257E,"R07_AN0257E: In past 12 months, time since completely quit using electronic nico",r07_an0257e,"r07_an0257e: in past 12 months, time since completely quit using electronic nico"
W7,R07_AN0145E_NN,"R07_AN0145E_NN: In past 12 months, longest time period for which you stopped usi",r07_an0145e_nn,"r07_an0145e_nn: in past 12 months, longest time period for which you stopped usi"
W7,R07_AN0145E_UN,"R07_AN0145E_UN: In past 12 months, longest time period for which you stopped usi",r07_an0145e_un,"r07_an0145e_un: in past 12 months, longest time period for which you stopped usi"
W7,R07_AN0305E,"R07_AN0305E: In past 12 months, longest time you stopped using electronic nicoti",r07_an0305e,"r07_an0305e: in past 12 months, longest time you stopped using electronic nicoti"
W7,R07_AN0210E,"R07_AN0210E: In past 12 months, relied on support of friends and family to help",r07_an0210e,"r07_an0210e: in past 12 months, relied on support of friends and family to help"
W7,R07_AN0215E,"R07_AN0215E: In past 12 months, used counseling, telephone help line, books, pam",r07_an0215e,"r07_an0215e: in past 12 months, used counseling, telephone help line, books, pam"
W7,R07_AX0505E,"R07_AX0505E: In past 12 months, used an app on a tablet computer or smartphone t",r07_ax0505e,"r07_ax0505e: in past 12 months, used an app on a tablet computer or smartphone t"
W7,R07_AN0225E_01,R07_AN0225E_01: Used a different tobacco product to help quit using electronic n,r07_an0225e_01,r07_an0225e_01: used a different tobacco product to help quit using electronic n
W7,R07_AN0225E_02,R07_AN0225E_02: Used a different tobacco product to help quit using electronic n,r07_an0225e_02,r07_an0225e_02: used a different tobacco product to help quit using electronic n
W7,R07_AN0225E_04,R07_AN0225E_04: Used a different tobacco product to help quit using electronic n,r07_an0225e_04,r07_an0225e_04: used a different tobacco product to help quit using electronic n
W7,R07_AN0225E_05,R07_AN0225E_05: Used a different tobacco product to help quit using electronic n,r07_an0225e_05,r07_an0225e_05: used a different tobacco product to help quit using electronic n
W7,R07_AN0225E_06,R07_AN0225E_06: Used a different tobacco product to help quit using electronic n,r07_an0225e_06,r07_an0225e_06: used a different tobacco product to help quit using electronic n
W7,R07_AN0225E_07,R07_AN0225E_07: Used a different tobacco product to help quit using electronic n,r07_an0225e_07,r07_an0225e_07: used a different tobacco product to help quit using electronic n
W7,R07_AN0225E_08,R07_AN0225E_08: Used a different tobacco product to help quit using electronic n,r07_an0225e_08,r07_an0225e_08: used a different tobacco product to help quit using electronic n
W7,R07_AN0225E_09,R07_AN0225E_09: Used a different tobacco product to help quit using electronic n,r07_an0225e_09,r07_an0225e_09: used a different tobacco product to help quit using electronic n
W7,R07_AN0225E_10,R07_AN0225E_10: Used a different tobacco product to help quit using electronic n,r07_an0225e_10,r07_an0225e_10: used a different tobacco product to help quit using electronic n
W7,R07_AN0225E_12,R07_AN0225E_12: Used a different tobacco product to help quit using electronic n,r07_an0225e_12,r07_an0225e_12: used a different tobacco product to help quit using electronic n
W7,R07_AN0225E_13,R07_AN0225E_13: Used a different tobacco product to help quit using electronic n,r07_an0225e_13,r07_an0225e_13: used a different tobacco product to help quit using electronic n
W7,R07_AN0225E_14,R07_AN0225E_14: Used a different tobacco product to help quit using electronic n,r07_an0225e_14,r07_an0225e_14: used a different tobacco product to help quit using electronic n
W7,R07_AN0330_12ME,"R07_AN0330_12ME: In past 12 months, used a nicotine patch, gum, inhaler, nasal s",r07_an0330_12me,"r07_an0330_12me: in past 12 months, used a nicotine patch, gum, inhaler, nasal s"
W7,R07_AN0161E_01,R07_AN0161E_01: Type of nicotine replacement therapy product used in past 12 mon,r07_an0161e_01,r07_an0161e_01: type of nicotine replacement therapy product used in past 12 mon
W7,R07_AN0161E_02,R07_AN0161E_02: Type of nicotine replacement therapy product used in past 12 mon,r07_an0161e_02,r07_an0161e_02: type of nicotine replacement therapy product used in past 12 mon
W7,R07_AN0161E_03,R07_AN0161E_03: Type of nicotine replacement therapy product used in past 12 mon,r07_an0161e_03,r07_an0161e_03: type of nicotine replacement therapy product used in past 12 mon
W7,R07_AN0161E_04,R07_AN0161E_04: Type of nicotine replacement therapy product used in past 12 mon,r07_an0161e_04,r07_an0161e_04: type of nicotine replacement therapy product used in past 12 mon
W7,R07_AN0161E_05,R07_AN0161E_05: Type of nicotine replacement therapy product used in past 12 mon,r07_an0161e_05,r07_an0161e_05: type of nicotine replacement therapy product used in past 12 mon
W7,R07_AN0150E,"R07_AN0150E: In past 12 months, used a nicotine patch, gum, inhaler, nasal spray",r07_an0150e,"r07_an0150e: in past 12 months, used a nicotine patch, gum, inhaler, nasal spray"
W7,R07_AN0155E,"R07_AN0155E: Used a nicotine patch, gum, inhaler, nasal spray or lozenge to quit",r07_an0155e,"r07_an0155e: used a nicotine patch, gum, inhaler, nasal spray or lozenge to quit"
W7,R07_AN0811E,"R07_AN0811E: Used a nicotine patch, gum, inhaler, nasal spray or lozenge to reli",r07_an0811e,"r07_an0811e: used a nicotine patch, gum, inhaler, nasal spray or lozenge to reli"
W7,R07_AN0160E_01,R07_AN0160E_01: NRT product used last time tried to quit using electronic nicoti,r07_an0160e_01,r07_an0160e_01: nrt product used last time tried to quit using electronic nicoti
W7,R07_AN0160E_02,R07_AN0160E_02: NRT product used last time tried to quit using electronic nicoti,r07_an0160e_02,r07_an0160e_02: nrt product used last time tried to quit using electronic nicoti
W7,R07_AN0160E_03,R07_AN0160E_03: NRT product used last time tried to quit using electronic nicoti,r07_an0160e_03,r07_an0160e_03: nrt product used last time tried to quit using electronic nicoti
W7,R07_AN0160E_04,R07_AN0160E_04: NRT product used last time tried to quit using electronic nicoti,r07_an0160e_04,r07_an0160e_04: nrt product used last time tried to quit using electronic nicoti
W7,R07_AN0160E_05,R07_AN0160E_05: NRT product used last time tried to quit using electronic nicoti,r07_an0160e_05,r07_an0160e_05: nrt product used last time tried to quit using electronic nicoti
W7,R07_AN0160E_06,R07_AN0160E_06: NRT product used last time tried to quit using electronic nicoti,r07_an0160e_06,r07_an0160e_06: nrt product used last time tried to quit using electronic nicoti
W7,R07_AN0165E_NN,R07_AN0165E_NN: Length of time used NRT during last electronic nicotine products,r07_an0165e_nn,r07_an0165e_nn: length of time used nrt during last electronic nicotine products
W7,R07_AN0165E_UN,R07_AN0165E_UN: Length of time used NRT during last electronic nicotine products,r07_an0165e_un,r07_an0165e_un: length of time used nrt during last electronic nicotine products
W7,R07_AN0170E,"R07_AN0170E: Currently using nicotine patch, gum, inhaler, nasal spray, or lozen",r07_an0170e,"r07_an0170e: currently using nicotine patch, gum, inhaler, nasal spray, or lozen"
W7,R07_AN0251E_NN,R07_AN0251E_NN: How long been using NRT - Number (past 12 month electronic nicot,r07_an0251e_nn,r07_an0251e_nn: how long been using nrt - number (past 12 month electronic nicot
W7,R07_AN0251E_UN,R07_AN0251E_UN: How long been using NRT - Unit (past 12 month electronic nicotin,r07_an0251e_un,r07_an0251e_un: how long been using nrt - unit (past 12 month electronic nicotin
W7,R07_AN0347E,R07_AN0347E: When last removed a nicotine patch (current or recent former establ,r07_an0347e,r07_an0347e: when last removed a nicotine patch (current or recent former establ
W7,R07_AN0348E,R07_AN0348E: Number of hours since you removed a nicotine patch (current or rece,r07_an0348e,r07_an0348e: number of hours since you removed a nicotine patch (current or rece
W7,R07_AN0349E,R07_AN0349E: Strength of nicotine patch last used (current or recent former esta,r07_an0349e,r07_an0349e: strength of nicotine patch last used (current or recent former esta
W7,R07_AN0375E_NN,R07_AN0375E_NN: How long ago did you stop using the nicotine patch - Number,r07_an0375e_nn,r07_an0375e_nn: how long ago did you stop using the nicotine patch - number
W7,R07_AN0375E_UN,R07_AN0375E_UN: How long ago did you stop using the nicotine patch - Unit,r07_an0375e_un,r07_an0375e_un: how long ago did you stop using the nicotine patch - unit
W7,R07_AN0357E,"R07_AN0357E: When you last used nicotine gum, inhaler, nasal spray, or lozenge (",r07_an0357e,"r07_an0357e: when you last used nicotine gum, inhaler, nasal spray, or lozenge ("
W7,R07_AN0358E,"R07_AN0358E: Time period of day when you last used nicotine gum, inhaler, nasal",r07_an0358e,"r07_an0358e: time period of day when you last used nicotine gum, inhaler, nasal"
W7,R07_AN0359E,"R07_AN0359E: Number of nicotine gum, inhaler, nasal spray, or lozenges used toda",r07_an0359e,"r07_an0359e: number of nicotine gum, inhaler, nasal spray, or lozenges used toda"
W7,R07_AN0385E_NN,"R07_AN0385E_NN: How long ago did you stop using nicotine gum, inhaler, spray, or",r07_an0385e_nn,"r07_an0385e_nn: how long ago did you stop using nicotine gum, inhaler, spray, or"
W7,R07_AN0385E_UN,"R07_AN0385E_UN: How long ago did you stop using nicotine gum, inhaler, spray, or",r07_an0385e_un,"r07_an0385e_un: how long ago did you stop using nicotine gum, inhaler, spray, or"
W7,R07_AN0331_12ME,"R07_AN0331_12ME: In past 12 months, used prescription drug: Chantix, varenicline",r07_an0331_12me,"r07_an0331_12me: in past 12 months, used prescription drug: chantix, varenicline"
W7,R07_AN0180E,"R07_AN0180E: In past 12 months, used a prescription drug the last time tried to",r07_an0180e,"r07_an0180e: in past 12 months, used a prescription drug the last time tried to"
W7,R07_AN0185E,R07_AN0185E: Used a prescription drug to quit using electronic nicotine products,r07_an0185e,r07_an0185e: used a prescription drug to quit using electronic nicotine products
W7,R07_AN0190E_01,R07_AN0190E_01: Prescription drug used the last time tried to quit/when quit usi,r07_an0190e_01,r07_an0190e_01: prescription drug used the last time tried to quit/when quit usi
W7,R07_AN0190E_02,R07_AN0190E_02: Prescription drug used the last time tried to quit/when quit usi,r07_an0190e_02,r07_an0190e_02: prescription drug used the last time tried to quit/when quit usi
W7,R07_AN0190E_03,R07_AN0190E_03: Prescription drug used the last time tried to quit/when quit usi,r07_an0190e_03,r07_an0190e_03: prescription drug used the last time tried to quit/when quit usi
W7,R07_AN0195E_NN,R07_AN0195E_NN: Length of time used prescription medication during last electron,r07_an0195e_nn,r07_an0195e_nn: length of time used prescription medication during last electron
W7,R07_AN0195E_UN,R07_AN0195E_UN: Length of time used prescription medication during last electron,r07_an0195e_un,r07_an0195e_un: length of time used prescription medication during last electron
W7,R07_AN0200E,R07_AN0200E: Currently using a prescription medication to help quit (past 12 mon,r07_an0200e,r07_an0200e: currently using a prescription medication to help quit (past 12 mon
W7,R07_AN0252E_NN,R07_AN0252E_NN: How long have you been using a prescription drug - Number (past,r07_an0252e_nn,r07_an0252e_nn: how long have you been using a prescription drug - number (past
W7,R07_AN0252E_UN,R07_AN0252E_UN: How long have you been using a prescription drug - Unit (past 12,r07_an0252e_un,r07_an0252e_un: how long have you been using a prescription drug - unit (past 12
W7,R07_AN0327E,"R07_AN0327E: When did you last use Chantix, varenicline, Wellbutrin, Zyban or bu",r07_an0327e,"r07_an0327e: when did you last use chantix, varenicline, wellbutrin, zyban or bu"
W7,R07_AN0328E,"R07_AN0328E: Time period of day when you last used Chantix, varenicline, Wellbut",r07_an0328e,"r07_an0328e: time period of day when you last used chantix, varenicline, wellbut"
W7,R07_AN0329E,"R07_AN0329E: Number of Chantix, varenicline, Wellbutrin, Zyban or bupropion take",r07_an0329e,"r07_an0329e: number of chantix, varenicline, wellbutrin, zyban or bupropion take"
W7,R07_AN0205E_NN,R07_AN0205E_NN: How long ago you stopped using prescription medication - Number,r07_an0205e_nn,r07_an0205e_nn: how long ago you stopped using prescription medication - number
W7,R07_AN0205E_UN,R07_AN0205E_UN: How long ago you stopped using prescription medication - Unit (c,r07_an0205e_un,r07_an0205e_un: how long ago you stopped using prescription medication - unit (c
W7,R07_AN0804E_RANDOM_01,R07_AN0804E_RANDOM_01: AN0804E series random question 1,r07_an0804e_random_01,r07_an0804e_random_01: an0804e series random question 1
W7,R07_AN0804E_RANDOM_02,R07_AN0804E_RANDOM_02: AN0804E series random question 2,r07_an0804e_random_02,r07_an0804e_random_02: an0804e series random question 2
W7,R07_AN0804E_RANDOM_03,R07_AN0804E_RANDOM_03: AN0804E series random question 3,r07_an0804e_random_03,r07_an0804e_random_03: an0804e series random question 3
W7,R07_AN0804E_RANDOM_04,R07_AN0804E_RANDOM_04: AN0804E series random question 4,r07_an0804e_random_04,r07_an0804e_random_04: an0804e series random question 4
W7,R07_AN0804E_RANDOM_05,R07_AN0804E_RANDOM_05: AN0804E series random question 5,r07_an0804e_random_05,r07_an0804e_random_05: an0804e series random question 5
W7,R07_AN0804E_RANDOM_06,R07_AN0804E_RANDOM_06: AN0804E series random question 6,r07_an0804e_random_06,r07_an0804e_random_06: an0804e series random question 6
