wave,var_name,label,var_lower,label_lower
W7,R07_AU1002,"R07_AU1002: Ever used snus, even one or two times",r07_au1002,"r07_au1002: ever used snus, even one or two times"
W7,R07_AU1004,"R07_AU1004: In past 30 days, used snus, even one or two times",r07_au1004,"r07_au1004: in past 30 days, used snus, even one or two times"
W7,R07_AU1002_12M,"R07_AU1002_12M: In past 12 months, used snus, even one or two times",r07_au1002_12m,"r07_au1002_12m: in past 12 months, used snus, even one or two times"
W7,R07_AU1003,R07_AU1003: Now use snus,r07_au1003,r07_au1003: now use snus
W7,R07_AU1009_NN,R07_AU1009_NN: How long since you last used snus - Number,r07_au1009_nn,r07_au1009_nn: how long since you last used snus - number
W7,R07_AU1009_UN,R07_AU1009_UN: How long since you last used snus - Unit,r07_au1009_un,r07_au1009_un: how long since you last used snus - unit
W7,R07_AU1010,R07_AU1010: Completely quit using snus,r07_au1010,r07_au1010: completely quit using snus
W7,R07_AU1103,R07_AU1103: Ever been curious about using snus,r07_au1103,r07_au1103: ever been curious about using snus
W7,R07_AU1206,R07_AU1206: Think you will use snus in the next year,r07_au1206,r07_au1206: think you will use snus in the next year
W7,R07_AU1104,R07_AU1104: Think you will try snus soon,r07_au1104,r07_au1104: think you will try snus soon
W7,R07_AU1205,R07_AU1205: Would try snus if a best friend offered it,r07_au1205,r07_au1205: would try snus if a best friend offered it
W7,R07_AS1001_RS,"R07_AS1001_RS: Ever seen or heard of smokeless tobacco, such as dip, spit, moist",r07_as1001_rs,"r07_as1001_rs: ever seen or heard of smokeless tobacco, such as dip, spit, moist"
W7,R07_AS1002,"R07_AS1002: Ever used smokeless tobacco, even one or two times",r07_as1002,"r07_as1002: ever used smokeless tobacco, even one or two times"
W7,R07_AS1004,"R07_AS1004: In past 30 days, used smokeless tobacco products, even one or two ti",r07_as1004,"r07_as1004: in past 30 days, used smokeless tobacco products, even one or two ti"
W7,R07_AS1002_12M,"R07_AS1002_12M: In past 12 months, used smokeless tobacco products, even one or",r07_as1002_12m,"r07_as1002_12m: in past 12 months, used smokeless tobacco products, even one or"
W7,R07_AS1003,R07_AS1003: Now use smokeless tobacco,r07_as1003,r07_as1003: now use smokeless tobacco
W7,R07_AS1009_NN,R07_AS1009_NN: How long since you last used smokeless tobacco - Number,r07_as1009_nn,r07_as1009_nn: how long since you last used smokeless tobacco - number
W7,R07_AS1009_UN,R07_AS1009_UN: How long since you last used smokeless tobacco - Unit,r07_as1009_un,r07_as1009_un: how long since you last used smokeless tobacco - unit
W7,R07_AS1010,R07_AS1010: Completely quit using smokeless tobacco,r07_as1010,r07_as1010: completely quit using smokeless tobacco
W7,R07_AS1103,R07_AS1103: Ever been curious about using smokeless tobacco,r07_as1103,r07_as1103: ever been curious about using smokeless tobacco
W7,R07_AS1206,R07_AS1206: Think you will use smokeless tobacco in the next year,r07_as1206,r07_as1206: think you will use smokeless tobacco in the next year
W7,R07_AS1104,R07_AS1104: Think you will try smokeless tobacco soon,r07_as1104,r07_as1104: think you will try smokeless tobacco soon
W7,R07_AS1205,R07_AS1205: Would try smokeless tobacco if a best friend offered it,r07_as1205,r07_as1205: would try smokeless tobacco if a best friend offered it
W7,R07_AQ1001,R07_AQ1001: Ever seen or heard of IQOS before this study,r07_aq1001,r07_aq1001: ever seen or heard of iqos before this study
W7,R07_AQ1002,"R07_AQ1002: Ever used IQOS, even one or two times",r07_aq1002,"r07_aq1002: ever used iqos, even one or two times"
W7,R07_AQ1004,"R07_AQ1004: In past 30 days, used IQOS, even one or two times",r07_aq1004,"r07_aq1004: in past 30 days, used iqos, even one or two times"
W7,R07_AQ1002_12M,"R07_AQ1002_12M: In past 12 months, used IQOS, even one or two times",r07_aq1002_12m,"r07_aq1002_12m: in past 12 months, used iqos, even one or two times"
W7,R07_AQ1003,R07_AQ1003: Now use IQOS,r07_aq1003,r07_aq1003: now use iqos
W7,R07_AQ1009_NN,R07_AQ1009_NN: How long since last used IQOS - Number,r07_aq1009_nn,r07_aq1009_nn: how long since last used iqos - number
W7,R07_AQ1009_UN,R07_AQ1009_UN: How long since last used IQOS - Unit,r07_aq1009_un,r07_aq1009_un: how long since last used iqos - unit
W7,R07_AQ1010,R07_AQ1010: Completely quit using IQOS,r07_aq1010,r07_aq1010: completely quit using iqos
W7,R07_AQ1103,R07_AQ1103: Ever been curious about using IQOS,r07_aq1103,r07_aq1103: ever been curious about using iqos
W7,R07_AQ1206,R07_AQ1206: Think you will use IQOS in the next year,r07_aq1206,r07_aq1206: think you will use iqos in the next year
W7,R07_AQ1104,R07_AQ1104: Think you will use IQOS soon,r07_aq1104,r07_aq1104: think you will use iqos soon
W7,R07_AQ1105,R07_AQ1105: Would try IQOS if one of your best friends offered it to you,r07_aq1105,r07_aq1105: would try iqos if one of your best friends offered it to you
W7,R07_AA1001NP,R07_AA1001NP: Ever seen or heard of nicotine pouches before this study,r07_aa1001np,r07_aa1001np: ever seen or heard of nicotine pouches before this study
W7,R07_AA1002NP,"R07_AA1002NP: Ever used nicotine pouches, even one or two times",r07_aa1002np,"r07_aa1002np: ever used nicotine pouches, even one or two times"
W7,R07_AA1004NP,"R07_AA1004NP: In the past 30 days, used nicotine pouches, even one or two times",r07_aa1004np,"r07_aa1004np: in the past 30 days, used nicotine pouches, even one or two times"
W7,R07_AA1002NP_12M,"R07_AA1002NP_12M: In the past 12 months, used nicotine pouches, even one or two",r07_aa1002np_12m,"r07_aa1002np_12m: in the past 12 months, used nicotine pouches, even one or two"
W7,R07_AA9448NP_01,R07_AA9448NP_01: Nicotine pouch brand used in past 30 days: Zyn,r07_aa9448np_01,r07_aa9448np_01: nicotine pouch brand used in past 30 days: zyn
W7,R07_AA9448NP_02,R07_AA9448NP_02: Nicotine pouch brand used in past 30 days: On!,r07_aa9448np_02,r07_aa9448np_02: nicotine pouch brand used in past 30 days: on!
W7,R07_AA9448NP_03,R07_AA9448NP_03: Nicotine pouch brand used in past 30 days: Velo,r07_aa9448np_03,r07_aa9448np_03: nicotine pouch brand used in past 30 days: velo
W7,R07_AA9448NP_04,R07_AA9448NP_04: Nicotine pouch brand used in past 30 days: Rogue,r07_aa9448np_04,r07_aa9448np_04: nicotine pouch brand used in past 30 days: rogue
W7,R07_AA9448NP_05,R07_AA9448NP_05: Nicotine pouch brand used in past 30 days: Rush,r07_aa9448np_05,r07_aa9448np_05: nicotine pouch brand used in past 30 days: rush
W7,R07_AA9448NP_06,R07_AA9448NP_06: Nicotine pouch brand used in past 30 days: NIIN,r07_aa9448np_06,r07_aa9448np_06: nicotine pouch brand used in past 30 days: niin
W7,R07_AA9448NP_07,R07_AA9448NP_07: Nicotine pouch brand used in past 30 days: FRE,r07_aa9448np_07,r07_aa9448np_07: nicotine pouch brand used in past 30 days: fre
W7,R07_AA9448NP_08,R07_AA9448NP_08: Nicotine pouch brand used in past 30 days: Bidi pouches,r07_aa9448np_08,r07_aa9448np_08: nicotine pouch brand used in past 30 days: bidi pouches
W7,R07_AA9448NP_09,R07_AA9448NP_09: Nicotine pouch brand used in past 30 days: Something else,r07_aa9448np_09,r07_aa9448np_09: nicotine pouch brand used in past 30 days: something else
W7,R07_AA0100NP,R07_AA0100NP: When last used a nicotine pouch,r07_aa0100np,r07_aa0100np: when last used a nicotine pouch
W7,R07_AA0102NP,R07_AA0102NP: Time period of day when you last used a nicotine pouch,r07_aa0102np,r07_aa0102np: time period of day when you last used a nicotine pouch
W7,R07_AA0103NP,R07_AA0103NP: Number of nicotine pouches used today/yesterday/day before yesterd,r07_aa0103np,r07_aa0103np: number of nicotine pouches used today/yesterday/day before yesterd
W7,R07_AA0106NP_01,"R07_AA0106NP_01: Nicotine pouch brand used today, yesterday, or the day before y",r07_aa0106np_01,"r07_aa0106np_01: nicotine pouch brand used today, yesterday, or the day before y"
W7,R07_AA0106NP_02,"R07_AA0106NP_02: Nicotine pouch brand used today, yesterday, or the day before y",r07_aa0106np_02,"r07_aa0106np_02: nicotine pouch brand used today, yesterday, or the day before y"
W7,R07_AA0106NP_03,"R07_AA0106NP_03: Nicotine pouch brand used today, yesterday, or the day before y",r07_aa0106np_03,"r07_aa0106np_03: nicotine pouch brand used today, yesterday, or the day before y"
W7,R07_AA0106NP_04,"R07_AA0106NP_04: Nicotine pouch brand used today, yesterday, or the day before y",r07_aa0106np_04,"r07_aa0106np_04: nicotine pouch brand used today, yesterday, or the day before y"
W7,R07_AA0106NP_05,"R07_AA0106NP_05: Nicotine pouch brand used today, yesterday, or the day before y",r07_aa0106np_05,"r07_aa0106np_05: nicotine pouch brand used today, yesterday, or the day before y"
W7,R07_AA0106NP_06,"R07_AA0106NP_06: Nicotine pouch brand used today, yesterday, or the day before y",r07_aa0106np_06,"r07_aa0106np_06: nicotine pouch brand used today, yesterday, or the day before y"
W7,R07_AA0106NP_07,"R07_AA0106NP_07: Nicotine pouch brand used today, yesterday, or the day before y",r07_aa0106np_07,"r07_aa0106np_07: nicotine pouch brand used today, yesterday, or the day before y"
W7,R07_AA0106NP_08,"R07_AA0106NP_08: Nicotine pouch brand used today, yesterday, or the day before y",r07_aa0106np_08,"r07_aa0106np_08: nicotine pouch brand used today, yesterday, or the day before y"
W7,R07_AA0106NP_09,"R07_AA0106NP_09: Nicotine pouch brand used today, yesterday, or the day before y",r07_aa0106np_09,"r07_aa0106np_09: nicotine pouch brand used today, yesterday, or the day before y"
W7,R07_AA1001OT,R07_AA1001OT: Ever seen or heard of oral nicotine products before this study,r07_aa1001ot,r07_aa1001ot: ever seen or heard of oral nicotine products before this study
W7,R07_AA1002OT,"R07_AA1002OT: Ever used an oral nicotine product, even one or two times",r07_aa1002ot,"r07_aa1002ot: ever used an oral nicotine product, even one or two times"
W7,R07_AA1004OT,"R07_AA1004OT: In the past 30 days, used an oral nicotine product, even one or tw",r07_aa1004ot,"r07_aa1004ot: in the past 30 days, used an oral nicotine product, even one or tw"
W7,R07_AA1002OT_12M,"R07_AA1002OT_12M: In the past 12 months, used an oral nicotine product, even one",r07_aa1002ot_12m,"r07_aa1002ot_12m: in the past 12 months, used an oral nicotine product, even one"
W7,R07_AA9449OT_01,R07_AA9449OT_01: Type of oral nicotine product used in past 30 days: Velo nicoti,r07_aa9449ot_01,r07_aa9449ot_01: type of oral nicotine product used in past 30 days: velo nicoti
W7,R07_AA9449OT_02,R07_AA9449OT_02: Type of oral nicotine product used in past 30 days: Rogue nicot,r07_aa9449ot_02,r07_aa9449ot_02: type of oral nicotine product used in past 30 days: rogue nicot
W7,R07_AA9449OT_03,R07_AA9449OT_03: Type of oral nicotine product used in past 30 days: Verve nicot,r07_aa9449ot_03,r07_aa9449ot_03: type of oral nicotine product used in past 30 days: verve nicot
W7,R07_AA9449OT_04,R07_AA9449OT_04: Type of oral nicotine product used in past 30 days: Rogue nicot,r07_aa9449ot_04,r07_aa9449ot_04: type of oral nicotine product used in past 30 days: rogue nicot
W7,R07_AA9449OT_05,R07_AA9449OT_05: Type of oral nicotine product used in past 30 days: Lucy nicoti,r07_aa9449ot_05,r07_aa9449ot_05: type of oral nicotine product used in past 30 days: lucy nicoti
W7,R07_AA9449OT_06,R07_AA9449OT_06: Type of oral nicotine product used in past 30 days: Pixotine ni,r07_aa9449ot_06,r07_aa9449ot_06: type of oral nicotine product used in past 30 days: pixotine ni
W7,R07_AA9449OT_07,R07_AA9449OT_07: Type of oral nicotine product used in past 30 days: Stonewall d,r07_aa9449ot_07,r07_aa9449ot_07: type of oral nicotine product used in past 30 days: stonewall d
W7,R07_AA9449OT_08,R07_AA9449OT_08: Type of oral nicotine product used in past 30 days: Something e,r07_aa9449ot_08,r07_aa9449ot_08: type of oral nicotine product used in past 30 days: something e
W7,R07_AA0100OT,R07_AA0100OT: When last used an oral nicotine product,r07_aa0100ot,r07_aa0100ot: when last used an oral nicotine product
W7,R07_AA0102OT,R07_AA0102OT: Time period of day when you last used an oral nicotine product,r07_aa0102ot,r07_aa0102ot: time period of day when you last used an oral nicotine product
W7,R07_AA0106OT_01,"R07_AA0106OT_01: Type of oral nicotine product used today, yesterday, or the day",r07_aa0106ot_01,"r07_aa0106ot_01: type of oral nicotine product used today, yesterday, or the day"
W7,R07_AA0106OT_02,"R07_AA0106OT_02: Type of oral nicotine product used today, yesterday, or the day",r07_aa0106ot_02,"r07_aa0106ot_02: type of oral nicotine product used today, yesterday, or the day"
W7,R07_AA0106OT_03,"R07_AA0106OT_03: Type of oral nicotine product used today, yesterday, or the day",r07_aa0106ot_03,"r07_aa0106ot_03: type of oral nicotine product used today, yesterday, or the day"
W7,R07_AA0106OT_04,"R07_AA0106OT_04: Type of oral nicotine product used today, yesterday, or the day",r07_aa0106ot_04,"r07_aa0106ot_04: type of oral nicotine product used today, yesterday, or the day"
W7,R07_AA0106OT_05,"R07_AA0106OT_05: Type of oral nicotine product used today, yesterday, or the day",r07_aa0106ot_05,"r07_aa0106ot_05: type of oral nicotine product used today, yesterday, or the day"
W7,R07_AA0106OT_06,"R07_AA0106OT_06: Type of oral nicotine product used today, yesterday, or the day",r07_aa0106ot_06,"r07_aa0106ot_06: type of oral nicotine product used today, yesterday, or the day"
W7,R07_AA0106OT_07,"R07_AA0106OT_07: Type of oral nicotine product used today, yesterday, or the day",r07_aa0106ot_07,"r07_aa0106ot_07: type of oral nicotine product used today, yesterday, or the day"
W7,R07_AA0106OT_08,"R07_AA0106OT_08: Type of oral nicotine product used today, yesterday, or the day",r07_aa0106ot_08,"r07_aa0106ot_08: type of oral nicotine product used today, yesterday, or the day"
W7,R07_AZ1002,R07_AZ1002: Ever used any other tobacco products,r07_az1002,r07_az1002: ever used any other tobacco products
W7,R07R_A_AC1006,R07R_A_AC1006: DERIVED - Age group when you first smoked part or all of a cigare,r07r_a_ac1006,r07r_a_ac1006: derived - age group when you first smoked part or all of a cigare
W7,R07_AC1005,R07_AC1005: Number of cigarettes smoked in your entire life,r07_ac1005,r07_ac1005: number of cigarettes smoked in your entire life
W7,R07_AC1100,R07_AC1100: Ever smoked cigarettes fairly regularly,r07_ac1100,r07_ac1100: ever smoked cigarettes fairly regularly
W7,R07R_A_AC1007,R07R_A_AC1007: DERIVED - Age group when you first started smoking cigarettes fai,r07r_a_ac1007,r07r_a_ac1007: derived - age group when you first started smoking cigarettes fai
W7,R07R_A_AC1020,R07R_A_AC1020: DERIVED - Age group when you first started smoking cigarettes eve,r07r_a_ac1020,r07r_a_ac1020: derived - age group when you first started smoking cigarettes eve
W7,R07_AC1008,"R07_AC1008: When first started smoking cigarettes, smoked cigarettes flavored to",r07_ac1008,"r07_ac1008: when first started smoking cigarettes, smoked cigarettes flavored to"
W7,R07_AC9904,R07_AC9904: How much pleasant sensation experienced the first time smoked a ciga,r07_ac9904,r07_ac9904: how much pleasant sensation experienced the first time smoked a ciga
W7,R07_AC9905,R07_AC9905: How much unpleasant sensation experienced the first time smoked a ci,r07_ac9905,r07_ac9905: how much unpleasant sensation experienced the first time smoked a ci
W7,R07_AC9906,R07_AC9906: How much felt sick to stomach the first time smoked a cigarette,r07_ac9906,r07_ac9906: how much felt sick to stomach the first time smoked a cigarette
W7,R07_AC9002_NN,R07_AC9002_NN: How long smoking/smoked cigarettes fairly regularly - Number,r07_ac9002_nn,r07_ac9002_nn: how long smoking/smoked cigarettes fairly regularly - number
W7,R07_AC9002_UN,R07_AC9002_UN: How long smoking/smoked cigarettes fairly regularly - Unit,r07_ac9002_un,r07_ac9002_un: how long smoking/smoked cigarettes fairly regularly - unit
W7,R07_AC9003_NN,R07_AC9003_NN: How many cigarettes smoked per day when you smoked fairly regular,r07_ac9003_nn,r07_ac9003_nn: how many cigarettes smoked per day when you smoked fairly regular
W7,R07_AC9003_UN,R07_AC9003_UN: How many cigarettes smoked per day when you smoked fairly regular,r07_ac9003_un,r07_ac9003_un: how many cigarettes smoked per day when you smoked fairly regular
W7,R07_AC1025_RS,"R07_AC1025_RS: Around this time 12 months ago, smoked cigarettes every day, some",r07_ac1025_rs,"r07_ac1025_rs: around this time 12 months ago, smoked cigarettes every day, some"
W7,R07_AC9006_RS_NN,R07_AC9006_RS_NN: Average number of cigarettes smoked per day 12 months ago - Nu,r07_ac9006_rs_nn,r07_ac9006_rs_nn: average number of cigarettes smoked per day 12 months ago - nu
W7,R07_AC9006_RS_UN,R07_AC9006_RS_UN: Average number of cigarettes smoked per day 12 months ago - Un,r07_ac9006_rs_un,r07_ac9006_rs_un: average number of cigarettes smoked per day 12 months ago - un
W7,R07_AC9140_RS,R07_AC9140_RS: Average number of cigarettes smoked each day around this time 12,r07_ac9140_rs,r07_ac9140_rs: average number of cigarettes smoked each day around this time 12
W7,R07_AC1021_NN,R07_AC1021_NN: Average number of cigarettes now smoked each day - Number,r07_ac1021_nn,r07_ac1021_nn: average number of cigarettes now smoked each day - number
W7,R07_AC1021_UN,R07_AC1021_UN: Average number of cigarettes now smoked each day - Unit,r07_ac1021_un,r07_ac1021_un: average number of cigarettes now smoked each day - unit
W7,R07_AC1090,R07_AC1090: Average number of cigarettes now smoked each day (Pack measure),r07_ac1090,r07_ac1090: average number of cigarettes now smoked each day (pack measure)
W7,R07_AC1022,"R07_AC1022: In past 30 days, number of days smoked cigarettes",r07_ac1022,"r07_ac1022: in past 30 days, number of days smoked cigarettes"
W7,R07_AC9029_NN,"R07_AC9029_NN: Time since last smoked a cigarette - Number (Current smokers, no",r07_ac9029_nn,"r07_ac9029_nn: time since last smoked a cigarette - number (current smokers, no"
W7,R07_AC9029_UN,"R07_AC9029_UN: Time since last smoked a cigarette - Unit (Current smokers, no pa",r07_ac9029_un,"r07_ac9029_un: time since last smoked a cigarette - unit (current smokers, no pa"
W7,R07_AC1023_NN,"R07_AC1023_NN: In past 30 days, average number of cigarettes smoked per day on d",r07_ac1023_nn,"r07_ac1023_nn: in past 30 days, average number of cigarettes smoked per day on d"
W7,R07_AC1023_UN,"R07_AC1023_UN: In past 30 days, average number of cigarettes smoked per day on d",r07_ac1023_un,"r07_ac1023_un: in past 30 days, average number of cigarettes smoked per day on d"
W7,R07_AC9004,R07_AC9004: Smoked same number of cigarettes per day since started smoking fairl,r07_ac9004,r07_ac9004: smoked same number of cigarettes per day since started smoking fairl
W7,R07_AC9009,R07_AC9009: Smoked same number of cigarettes per day since started smoking fairl,r07_ac9009,r07_ac9009: smoked same number of cigarettes per day since started smoking fairl
W7,R07_AC9005_NN,R07_AC9005_NN: Average number of cigarettes smoked per day when smoked fairly re,r07_ac9005_nn,r07_ac9005_nn: average number of cigarettes smoked per day when smoked fairly re
W7,R07_AC9005_UN,R07_AC9005_UN: Average number of cigarettes smoked per day when smoked fairly re,r07_ac9005_un,r07_ac9005_un: average number of cigarettes smoked per day when smoked fairly re
W7,R07_AC9022,R07_AC9022: Consider yourself a smoker,r07_ac9022,r07_ac9022: consider yourself a smoker
W7,R07_AC9045,R07_AC9045: Level of Agreement: Enjoy sensation in throat and chest when smoking,r07_ac9045,r07_ac9045: level of agreement: enjoy sensation in throat and chest when smoking
W7,R07_AC1024_NN,R07_AC1024_NN: Time to first cigarette after waking on days smoked - Number (cur,r07_ac1024_nn,r07_ac1024_nn: time to first cigarette after waking on days smoked - number (cur
W7,R07_AC1024_UN,R07_AC1024_UN: Time to first cigarette after waking on days smoked - Unit (curre,r07_ac1024_un,r07_ac1024_un: time to first cigarette after waking on days smoked - unit (curre
W7,R07_AC1092,R07_AC1092: Smoke first cigarette of the day within 30 minutes after waking (cur,r07_ac1092,r07_ac1092: smoke first cigarette of the day within 30 minutes after waking (cur
W7,R07_AC9052,R07_AC9052: Cigarette you would hate most to give up,r07_ac9052,r07_ac9052: cigarette you would hate most to give up
W7,R07_AC9053,R07_AC9053: Smoke cigarettes more frequently during the first hours after waking,r07_ac9053,r07_ac9053: smoke cigarettes more frequently during the first hours after waking
W7,R07_AC9054,R07_AC9054: Smoke cigarettes even if ill in bed all day,r07_ac9054,r07_ac9054: smoke cigarettes even if ill in bed all day
W7,R07_AC9048,"R07_AC9048: When smoking cigarettes, usually smoke manufactured cigarettes or ro",r07_ac9048,"r07_ac9048: when smoking cigarettes, usually smoke manufactured cigarettes or ro"
W7,R07_AC0100MC,R07_AC0100MC: When last smoked a cigarette,r07_ac0100mc,r07_ac0100mc: when last smoked a cigarette
W7,R07_AC0102MC,R07_AC0102MC: Time period of day when you last smoked a cigarette,r07_ac0102mc,r07_ac0102mc: time period of day when you last smoked a cigarette
W7,R07_AC0103MC,R07_AC0103MC: Number of cigarettes smoked today/yesterday/day before yesterday,r07_ac0103mc,r07_ac0103mc: number of cigarettes smoked today/yesterday/day before yesterday
W7,R07_AC1130MC,"R07_AC1130MC: In past 30 days, cigarette flavor smoked: Menthol or mint",r07_ac1130mc,"r07_ac1130mc: in past 30 days, cigarette flavor smoked: menthol or mint"
W7,R07_AC1142MC,R07_AC1142MC: Anyone sell you cigarettes in the past 30 days,r07_ac1142mc,r07_ac1142mc: anyone sell you cigarettes in the past 30 days
W7,R07_AC1123MC,"R07_AC1123MC: In past 30 days, someone refused to sell you cigarettes because of",r07_ac1123mc,"r07_ac1123mc: in past 30 days, someone refused to sell you cigarettes because of"
W7,R07_AC1030MC,R07_AC1030MC: How you usually buy your cigarettes,r07_ac1030mc,r07_ac1030mc: how you usually buy your cigarettes
W7,R07_AC1118MC,R07_AC1118MC: How you usually get your own cigarettes,r07_ac1118mc,r07_ac1118mc: how you usually get your own cigarettes
W7,R07_AC1032MC,R07_AC1032MC: Geographic area where you usually buy your cigarettes,r07_ac1032mc,r07_ac1032mc: geographic area where you usually buy your cigarettes
W7,R07_AC1033MC,R07_AC1033MC: Retail location where your cigarettes are purchased most of the ti,r07_ac1033mc,r07_ac1033mc: retail location where your cigarettes are purchased most of the ti
W7,R07_AC1039,"R07_AC1039: Usually buy cigarettes by carton, pack or as single cigarettes",r07_ac1039,"r07_ac1039: usually buy cigarettes by carton, pack or as single cigarettes"
W7,R07_AC1040,R07_AC1040: Number of cigarette packs in the carton you usually buy,r07_ac1040,r07_ac1040: number of cigarette packs in the carton you usually buy
W7,R07_AC1041_D,R07_AC1041_D: Amount usually paid for a carton of cigarettes - Dollars,r07_ac1041_d,r07_ac1041_d: amount usually paid for a carton of cigarettes - dollars
W7,R07_AC1041_C,R07_AC1041_C: Amount usually paid for a carton of cigarettes - Cents,r07_ac1041_c,r07_ac1041_c: amount usually paid for a carton of cigarettes - cents
W7,R07_AC1042_D,R07_AC1042_D: Amount usually paid for a pack of cigarettes - Dollars,r07_ac1042_d,r07_ac1042_d: amount usually paid for a pack of cigarettes - dollars
W7,R07_AC1042_C,R07_AC1042_C: Amount usually paid for a pack of cigarettes - Cents,r07_ac1042_c,r07_ac1042_c: amount usually paid for a pack of cigarettes - cents
W7,R07_AC1043_D,R07_AC1043_D: Amount usually paid for a single cigarette - Dollars,r07_ac1043_d,r07_ac1043_d: amount usually paid for a single cigarette - dollars
W7,R07_AC1043_C,R07_AC1043_C: Amount usually paid for a single cigarette - Cents,r07_ac1043_c,r07_ac1043_c: amount usually paid for a single cigarette - cents
W7,R07_AC8800,R07_AC8800: Where you usually throw away cigarette butts after you finish smokin,r07_ac8800,r07_ac8800: where you usually throw away cigarette butts after you finish smokin
W7,R07_AC8801,R07_AC8801: What you usually do with a cigarette pack or carton when it's empty,r07_ac8801,r07_ac8801: what you usually do with a cigarette pack or carton when it's empty
W7,R07_AC1047MC,R07_AC1047MC: Have a regular brand of cigarettes you usually smoke,r07_ac1047mc,r07_ac1047mc: have a regular brand of cigarettes you usually smoke
W7,R07_AC1050,R07_AC1050: Regular/last brand of cigarettes smoked  flavored to taste like ment,r07_ac1050,r07_ac1050: regular/last brand of cigarettes smoked  flavored to taste like ment
W7,R07_AC1945MC,R07_AC1945MC: Know the name of brand of cigarettes usually/last smoked,r07_ac1945mc,r07_ac1945mc: know the name of brand of cigarettes usually/last smoked
W7,R07_AC1048MC_BRAND,R07_AC1048MC_BRAND: Brand of cigarettes usually/last smoked,r07_ac1048mc_brand,r07_ac1048mc_brand: brand of cigarettes usually/last smoked
W7,R07_AC1070MC_PRODUCT,R07_AC1070MC_PRODUCT: Sub-brand of cigarette product usually/last smoked,r07_ac1070mc_product,r07_ac1070mc_product: sub-brand of cigarette product usually/last smoked
W7,R07_AC1051MC_NN,R07_AC1051MC_NN: How long smoked regular brand of manufactured cigarettes - Numb,r07_ac1051mc_nn,r07_ac1051mc_nn: how long smoked regular brand of manufactured cigarettes - numb
W7,R07_AC1051MC_UN,R07_AC1051MC_UN: How long smoked regular brand of manufactured cigarettes - Unit,r07_ac1051mc_un,r07_ac1051mc_un: how long smoked regular brand of manufactured cigarettes - unit
W7,R07_AC0100RY,R07_AC0100RY: When last smoked a roll-your-own cigarette,r07_ac0100ry,r07_ac0100ry: when last smoked a roll-your-own cigarette
W7,R07_AC0102RY,R07_AC0102RY: Time period of day when you last smoked a roll-your-own cigarette,r07_ac0102ry,r07_ac0102ry: time period of day when you last smoked a roll-your-own cigarette
W7,R07_AC0103RY,R07_AC0103RY: Number of roll-your-own cigarettes smoked today/yesterday/day befo,r07_ac0103ry,r07_ac0103ry: number of roll-your-own cigarettes smoked today/yesterday/day befo
