wave,var_name,label,var_lower,label_lower
W6,R06_AN0145_UN,"R06_AN0145_UN: In past 12 months, longest time period for which you stopped smok",r06_an0145_un,"r06_an0145_un: in past 12 months, longest time period for which you stopped smok"
W6,R06_AN0305,"R06_AN0305: In past 12 months, longest time you stopped smoking/using tobacco pr",r06_an0305,"r06_an0305: in past 12 months, longest time you stopped smoking/using tobacco pr"
W6,R06_AN0210,"R06_AN0210: In past 12 months, relied on support of friends and family to help w",r06_an0210,"r06_an0210: in past 12 months, relied on support of friends and family to help w"
W6,R06_AN0215,"R06_AN0215: In past 12 months, used counseling, telephone help line, books, pamp",r06_an0215,"r06_an0215: in past 12 months, used counseling, telephone help line, books, pamp"
W6,R06_AX0505,"R06_AX0505: In the past 12 months, used an app on a tablet computer or smartphon",r06_ax0505,"r06_ax0505: in the past 12 months, used an app on a tablet computer or smartphon"
W6,R06_AN0225_01,R06_AN0225_01: Used a different tobacco product to help quit smoking/using tobac,r06_an0225_01,r06_an0225_01: used a different tobacco product to help quit smoking/using tobac
W6,R06_AN0225_02,R06_AN0225_02: Used a different tobacco product to help quit smoking/using tobac,r06_an0225_02,r06_an0225_02: used a different tobacco product to help quit smoking/using tobac
W6,R06_AN0225_03,R06_AN0225_03: Used a different tobacco product to help quit smoking/using tobac,r06_an0225_03,r06_an0225_03: used a different tobacco product to help quit smoking/using tobac
W6,R06_AN0225_04,R06_AN0225_04: Used a different tobacco product to help quit smoking/using tobac,r06_an0225_04,r06_an0225_04: used a different tobacco product to help quit smoking/using tobac
W6,R06_AN0225_05,R06_AN0225_05: Used a different tobacco product to help quit smoking/using tobac,r06_an0225_05,r06_an0225_05: used a different tobacco product to help quit smoking/using tobac
W6,R06_AN0225_06,R06_AN0225_06: Used a different tobacco product to help quit smoking/using tobac,r06_an0225_06,r06_an0225_06: used a different tobacco product to help quit smoking/using tobac
W6,R06_AN0225_07,R06_AN0225_07: Used a different tobacco product to help quit smoking/using tobac,r06_an0225_07,r06_an0225_07: used a different tobacco product to help quit smoking/using tobac
W6,R06_AN0225_08,R06_AN0225_08: Used a different tobacco product to help quit smoking/using tobac,r06_an0225_08,r06_an0225_08: used a different tobacco product to help quit smoking/using tobac
W6,R06_AN0225_09,R06_AN0225_09: Used a different tobacco product to help quit smoking/using tobac,r06_an0225_09,r06_an0225_09: used a different tobacco product to help quit smoking/using tobac
W6,R06_AN0225_10,R06_AN0225_10: Used a different tobacco product to help quit smoking/using tobac,r06_an0225_10,r06_an0225_10: used a different tobacco product to help quit smoking/using tobac
W6,R06_AN0225_11,R06_AN0225_11: Used a different tobacco product to help quit smoking/using tobac,r06_an0225_11,r06_an0225_11: used a different tobacco product to help quit smoking/using tobac
W6,R06_AN0225_12,R06_AN0225_12: Used a different tobacco product to help quit smoking/using tobac,r06_an0225_12,r06_an0225_12: used a different tobacco product to help quit smoking/using tobac
W6,R06_AN0258,R06_AN0258: When started using e-cigarettes or other electronic nicotine product,r06_an0258,r06_an0258: when started using e-cigarettes or other electronic nicotine product
W6,R06_AN0270_NN,R06_AN0270_NN: How long used tobacco product along with e-cigarettes or other el,r06_an0270_nn,r06_an0270_nn: how long used tobacco product along with e-cigarettes or other el
W6,R06_AN0270_UN,R06_AN0270_UN: How long used tobacco product along with e-cigarettes or other el,r06_an0270_un,r06_an0270_un: how long used tobacco product along with e-cigarettes or other el
W6,R06_AN0271_NN,R06_AN0271_NN: How long used e-cigarette or other electronic nicotine products t,r06_an0271_nn,r06_an0271_nn: how long used e-cigarette or other electronic nicotine products t
W6,R06_AN0271_UN,R06_AN0271_UN: How long used e-cigarette or other electronic nicotine products t,r06_an0271_un,r06_an0271_un: how long used e-cigarette or other electronic nicotine products t
W6,R06_AN0260_NN,R06_AN0260_NN: How long used e-cigarettes or other electronic nicotine products,r06_an0260_nn,r06_an0260_nn: how long used e-cigarettes or other electronic nicotine products
W6,R06_AN0260_UN,R06_AN0260_UN: How long used e-cigarettes or other electronic nicotine products,r06_an0260_un,r06_an0260_un: how long used e-cigarettes or other electronic nicotine products
W6,R06_AN0259,R06_AN0259: Frequency of e-cigarette or other electronic nicotine product use du,r06_an0259,r06_an0259: frequency of e-cigarette or other electronic nicotine product use du
W6,R06_AN0261,R06_AN0261: E-cigarette or electronic nicotine product you used most often durin,r06_an0261,r06_an0261: e-cigarette or electronic nicotine product you used most often durin
W6,R06_AN0262,R06_AN0262: Concentration of nicotine used most often during last quit attempt,r06_an0262,r06_an0262: concentration of nicotine used most often during last quit attempt
W6,R06_AN0263_01,R06_AN0263_01: Flavor of e-liquid used during last quit attempt: Tobacco-flavore,r06_an0263_01,r06_an0263_01: flavor of e-liquid used during last quit attempt: tobacco-flavore
W6,R06_AN0263_02,R06_AN0263_02: Flavor of e-liquid used during last quit attempt: Menthol,r06_an0263_02,r06_an0263_02: flavor of e-liquid used during last quit attempt: menthol
W6,R06_AN0263_03,R06_AN0263_03: Flavor of e-liquid used during last quit attempt: Mint,r06_an0263_03,r06_an0263_03: flavor of e-liquid used during last quit attempt: mint
W6,R06_AN0263_04,R06_AN0263_04: Flavor of e-liquid used during last quit attempt: Clove or spice,r06_an0263_04,r06_an0263_04: flavor of e-liquid used during last quit attempt: clove or spice
W6,R06_AN0263_05,R06_AN0263_05: Flavor of e-liquid used during last quit attempt: Fruit,r06_an0263_05,r06_an0263_05: flavor of e-liquid used during last quit attempt: fruit
W6,R06_AN0263_06,R06_AN0263_06: Flavor of e-liquid used during last quit attempt: Chocolate,r06_an0263_06,r06_an0263_06: flavor of e-liquid used during last quit attempt: chocolate
W6,R06_AN0263_07,R06_AN0263_07: Flavor of e-liquid used during last quit attempt: An alcoholic dr,r06_an0263_07,r06_an0263_07: flavor of e-liquid used during last quit attempt: an alcoholic dr
W6,R06_AN0263_08,R06_AN0263_08: Flavor of e-liquid used during last quit attempt: A non-alcoholic,r06_an0263_08,r06_an0263_08: flavor of e-liquid used during last quit attempt: a non-alcoholic
W6,R06_AN0263_09,"R06_AN0263_09: Flavor of e-liquid used during last quit attempt: Candy, desserts",r06_an0263_09,"r06_an0263_09: flavor of e-liquid used during last quit attempt: candy, desserts"
W6,R06_AN0263_10,R06_AN0263_10: Flavor of e-liquid used during last quit attempt: Some other flav,r06_an0263_10,r06_an0263_10: flavor of e-liquid used during last quit attempt: some other flav
W6,R06_AN0264,R06_AN0264: Flavor of e-liquid used most often during last quit attempt,r06_an0264,r06_an0264: flavor of e-liquid used most often during last quit attempt
W6,R06_AN0265,R06_AN0265: Type of e-cigarette or electronic nicotine product used most often d,r06_an0265,r06_an0265: type of e-cigarette or electronic nicotine product used most often d
W6,R06_AN0266,R06_AN0266: Know the name of the brand of e-cigarette or electronic nicotine pro,r06_an0266,r06_an0266: know the name of the brand of e-cigarette or electronic nicotine pro
W6,R06_AN0267_BRAND,R06_AN0267_BRAND: Brand of e-cigarette or electronic nicotine product used most,r06_an0267_brand,r06_an0267_brand: brand of e-cigarette or electronic nicotine product used most
W6,R06_AN0330_12M,"R06_AN0330_12M: In past 12 months, used a nicotine patch, gum, inhaler, nasal sp",r06_an0330_12m,"r06_an0330_12m: in past 12 months, used a nicotine patch, gum, inhaler, nasal sp"
W6,R06_AN0161_01,R06_AN0161_01: Type of nicotine replacement therapy product used in past 12 mont,r06_an0161_01,r06_an0161_01: type of nicotine replacement therapy product used in past 12 mont
W6,R06_AN0161_02,R06_AN0161_02: Type of nicotine replacement therapy product used in past 12 mont,r06_an0161_02,r06_an0161_02: type of nicotine replacement therapy product used in past 12 mont
W6,R06_AN0161_03,R06_AN0161_03: Type of nicotine replacement therapy product used in past 12 mont,r06_an0161_03,r06_an0161_03: type of nicotine replacement therapy product used in past 12 mont
W6,R06_AN0161_04,R06_AN0161_04: Type of nicotine replacement therapy product used in past 12 mont,r06_an0161_04,r06_an0161_04: type of nicotine replacement therapy product used in past 12 mont
W6,R06_AN0161_05,R06_AN0161_05: Type of nicotine replacement therapy product used in past 12 mont,r06_an0161_05,r06_an0161_05: type of nicotine replacement therapy product used in past 12 mont
W6,R06_AN0150,"R06_AN0150: In past 12 months, used a nicotine patch, gum, inhaler, nasal spray",r06_an0150,"r06_an0150: in past 12 months, used a nicotine patch, gum, inhaler, nasal spray"
W6,R06_AN0155,"R06_AN0155: Used a nicotine patch, gum, inhaler, nasal spray or lozenge to quit",r06_an0155,"r06_an0155: used a nicotine patch, gum, inhaler, nasal spray or lozenge to quit"
W6,R06_AN0811,"R06_AN0811: Used a nicotine patch, gum, inhaler, nasal spray or lozenge to relie",r06_an0811,"r06_an0811: used a nicotine patch, gum, inhaler, nasal spray or lozenge to relie"
W6,R06_AN0336,"R06_AN0336: Main reason you used a nicotine patch, gum, inhaler, nasal spray, or",r06_an0336,"r06_an0336: main reason you used a nicotine patch, gum, inhaler, nasal spray, or"
W6,R06_AN0160_01,R06_AN0160_01: NRT product used last time tried to quit smoking/using tobacco pr,r06_an0160_01,r06_an0160_01: nrt product used last time tried to quit smoking/using tobacco pr
W6,R06_AN0160_02,R06_AN0160_02: NRT product used last time tried to quit smoking/using tobacco pr,r06_an0160_02,r06_an0160_02: nrt product used last time tried to quit smoking/using tobacco pr
W6,R06_AN0160_03,R06_AN0160_03: NRT product used last time tried to quit smoking/using tobacco pr,r06_an0160_03,r06_an0160_03: nrt product used last time tried to quit smoking/using tobacco pr
W6,R06_AN0160_04,R06_AN0160_04: NRT product used last time tried to quit smoking/using tobacco pr,r06_an0160_04,r06_an0160_04: nrt product used last time tried to quit smoking/using tobacco pr
W6,R06_AN0160_05,R06_AN0160_05: NRT product used last time tried to quit smoking/using tobacco pr,r06_an0160_05,r06_an0160_05: nrt product used last time tried to quit smoking/using tobacco pr
W6,R06_AN0160_06,R06_AN0160_06: NRT product used last time tried to quit smoking/using tobacco pr,r06_an0160_06,r06_an0160_06: nrt product used last time tried to quit smoking/using tobacco pr
W6,R06_AN0165_NN,R06_AN0165_NN: Length of time used NRT during last tobacco product(s) quit attem,r06_an0165_nn,r06_an0165_nn: length of time used nrt during last tobacco product(s) quit attem
W6,R06_AN0165_UN,R06_AN0165_UN: Length of time used NRT during last tobacco product(s) quit attem,r06_an0165_un,r06_an0165_un: length of time used nrt during last tobacco product(s) quit attem
W6,R06_AN0170,"R06_AN0170: Currently using nicotine patch, gum, inhaler, nasal spray, or lozeng",r06_an0170,"r06_an0170: currently using nicotine patch, gum, inhaler, nasal spray, or lozeng"
W6,R06_AN0251_NN,R06_AN0251_NN: How long been using NRT - Number (past 12 month non-electronic to,r06_an0251_nn,r06_an0251_nn: how long been using nrt - number (past 12 month non-electronic to
W6,R06_AN0251_UN,R06_AN0251_UN: How long been using NRT - Unit (past 12 month non-electronic toba,r06_an0251_un,r06_an0251_un: how long been using nrt - unit (past 12 month non-electronic toba
W6,R06_AN0347,R06_AN0347: When last removed a nicotine patch (current or recent former establi,r06_an0347,r06_an0347: when last removed a nicotine patch (current or recent former establi
W6,R06_AN0348,R06_AN0348: Number of hours since you removed a nicotine patch (current or recen,r06_an0348,r06_an0348: number of hours since you removed a nicotine patch (current or recen
W6,R06_AN0349,R06_AN0349: Strength of nicotine patch last used (current or recent former estab,r06_an0349,r06_an0349: strength of nicotine patch last used (current or recent former estab
W6,R06_AN0375_NN,R06_AN0375_NN: How long ago did you stop using the nicotine patch - Number,r06_an0375_nn,r06_an0375_nn: how long ago did you stop using the nicotine patch - number
W6,R06_AN0375_UN,R06_AN0375_UN: How long ago did you stop using the nicotine patch - Unit,r06_an0375_un,r06_an0375_un: how long ago did you stop using the nicotine patch - unit
W6,R06_AN0357,"R06_AN0357: When you last used nicotine gum, inhaler, nasal spray, or lozenge (c",r06_an0357,"r06_an0357: when you last used nicotine gum, inhaler, nasal spray, or lozenge (c"
W6,R06_AN0358,"R06_AN0358: Time period of day when you last used nicotine gum, inhaler, nasal s",r06_an0358,"r06_an0358: time period of day when you last used nicotine gum, inhaler, nasal s"
W6,R06_AN0359,"R06_AN0359: Number of nicotine gum, inhaler, nasal spray, or lozenges used today",r06_an0359,"r06_an0359: number of nicotine gum, inhaler, nasal spray, or lozenges used today"
W6,R06_AN0385_NN,"R06_AN0385_NN: How long ago did you stop using nicotine gum, inhaler, spray, or",r06_an0385_nn,"r06_an0385_nn: how long ago did you stop using nicotine gum, inhaler, spray, or"
W6,R06_AN0385_UN,"R06_AN0385_UN: How long ago did you stop using nicotine gum, inhaler, spray, or",r06_an0385_un,"r06_an0385_un: how long ago did you stop using nicotine gum, inhaler, spray, or"
W6,R06_AN0331_12M,"R06_AN0331_12M: In past 12 months, used prescription drug: Chantix, varenicline,",r06_an0331_12m,"r06_an0331_12m: in past 12 months, used prescription drug: chantix, varenicline,"
W6,R06_AN0180,"R06_AN0180: In past 12 months, used a prescription drug the last time tried to q",r06_an0180,"r06_an0180: in past 12 months, used a prescription drug the last time tried to q"
W6,R06_AN0185,R06_AN0185: Used a prescription drug to quit smoking/using tobacco product(s) co,r06_an0185,r06_an0185: used a prescription drug to quit smoking/using tobacco product(s) co
W6,R06_AN0190_01,R06_AN0190_01: Prescription drug used the last time tried to quit/when quit smok,r06_an0190_01,r06_an0190_01: prescription drug used the last time tried to quit/when quit smok
W6,R06_AN0190_02,R06_AN0190_02: Prescription drug used the last time tried to quit/when quit smok,r06_an0190_02,r06_an0190_02: prescription drug used the last time tried to quit/when quit smok
W6,R06_AN0190_03,R06_AN0190_03: Prescription drug used the last time tried to quit/when quit smok,r06_an0190_03,r06_an0190_03: prescription drug used the last time tried to quit/when quit smok
W6,R06_AN0195_NN,R06_AN0195_NN: Length of time used prescription medication during last tobacco p,r06_an0195_nn,r06_an0195_nn: length of time used prescription medication during last tobacco p
W6,R06_AN0195_UN,R06_AN0195_UN: Length of time used prescription medication during last tobacco p,r06_an0195_un,r06_an0195_un: length of time used prescription medication during last tobacco p
W6,R06_AN0200,R06_AN0200: Currently using a prescription medication to help quit (past 12 mont,r06_an0200,r06_an0200: currently using a prescription medication to help quit (past 12 mont
W6,R06_AN0252_NN,R06_AN0252_NN: How long have you been using a prescription drug - Number (past 1,r06_an0252_nn,r06_an0252_nn: how long have you been using a prescription drug - number (past 1
W6,R06_AN0252_UN,R06_AN0252_UN: How long have you been using a prescription drug - Unit (past 12,r06_an0252_un,r06_an0252_un: how long have you been using a prescription drug - unit (past 12
W6,R06_AN0230,R06_AN0230: Level of interest in quitting smoking/using tobacco product(s) on a,r06_an0230,r06_an0230: level of interest in quitting smoking/using tobacco product(s) on a
W6,R06_AN0235,R06_AN0235: Plans to quit smoking/using tobacco product(s) for good,r06_an0235,r06_an0235: plans to quit smoking/using tobacco product(s) for good
W6,R06_AN0240,R06_AN0240: Time-frame when planning to quit smoking/using tobacco product(s) fo,r06_an0240,r06_an0240: time-frame when planning to quit smoking/using tobacco product(s) fo
W6,R06_AN0245,R06_AN0245: Likeliness of succeeding if tried to quit smoking/using tobacco prod,r06_an0245,r06_an0245: likeliness of succeeding if tried to quit smoking/using tobacco prod
W6,R06_AN0327,"R06_AN0327: When did you last use Chantix, varenicline, Wellbutrin, Zyban or bup",r06_an0327,"r06_an0327: when did you last use chantix, varenicline, wellbutrin, zyban or bup"
W6,R06_AN0328,"R06_AN0328: Time period of day when you last used Chantix, varenicline, Wellbutr",r06_an0328,"r06_an0328: time period of day when you last used chantix, varenicline, wellbutr"
W6,R06_AN0329,"R06_AN0329: Number of Chantix, varenicline, Wellbutrin, Zyban or bupropion taken",r06_an0329,"r06_an0329: number of chantix, varenicline, wellbutrin, zyban or bupropion taken"
W6,R06_AN0205_NN,R06_AN0205_NN: How long ago you stopped using prescription medication - Number (,r06_an0205_nn,r06_an0205_nn: how long ago you stopped using prescription medication - number (
W6,R06_AN0205_UN,R06_AN0205_UN: How long ago you stopped using prescription medication - Unit (Cu,r06_an0205_un,r06_an0205_un: how long ago you stopped using prescription medication - unit (cu
W6,R06_AN0804_RANDOM_01,R06_AN0804_RANDOM_01: AN0804 series random question 1,r06_an0804_random_01,r06_an0804_random_01: an0804 series random question 1
W6,R06_AN0804_RANDOM_02,R06_AN0804_RANDOM_02: AN0804 series random question 2,r06_an0804_random_02,r06_an0804_random_02: an0804 series random question 2
W6,R06_AN0804_RANDOM_03,R06_AN0804_RANDOM_03: AN0804 series random question 3,r06_an0804_random_03,r06_an0804_random_03: an0804 series random question 3
W6,R06_AN0804_RANDOM_04,R06_AN0804_RANDOM_04: AN0804 series random question 4,r06_an0804_random_04,r06_an0804_random_04: an0804 series random question 4
W6,R06_AN0804_RANDOM_05,R06_AN0804_RANDOM_05: AN0804 series random question 5,r06_an0804_random_05,r06_an0804_random_05: an0804 series random question 5
W6,R06_AN0804_RANDOM_06,R06_AN0804_RANDOM_06: AN0804 series random question 6,r06_an0804_random_06,r06_an0804_random_06: an0804 series random question 6
W6,R06_AN0804_RANDOM_07,R06_AN0804_RANDOM_07: AN0804 series random question 7,r06_an0804_random_07,r06_an0804_random_07: an0804 series random question 7
W6,R06_AN0804,"R06_AN0804: In past 12 months, effect of quitting/cutting back tobacco product(s",r06_an0804,"r06_an0804: in past 12 months, effect of quitting/cutting back tobacco product(s"
W6,R06_AN0805,"R06_AN0805: In past 12 months, effect of quitting/cutting back tobacco product(s",r06_an0805,"r06_an0805: in past 12 months, effect of quitting/cutting back tobacco product(s"
W6,R06_AN0806,"R06_AN0806: In past 12 months, effect of quitting/cutting back tobacco product(s",r06_an0806,"r06_an0806: in past 12 months, effect of quitting/cutting back tobacco product(s"
W6,R06_AN0807,"R06_AN0807: In past 12 months, effect of quitting/cutting back tobacco product(s",r06_an0807,"r06_an0807: in past 12 months, effect of quitting/cutting back tobacco product(s"
W6,R06_AN0808,"R06_AN0808: In past 12 months, effect of quitting/cutting back tobacco product(s",r06_an0808,"r06_an0808: in past 12 months, effect of quitting/cutting back tobacco product(s"
W6,R06_AN0809,"R06_AN0809: In past 12 months, effect of quitting/cutting back tobacco product(s",r06_an0809,"r06_an0809: in past 12 months, effect of quitting/cutting back tobacco product(s"
W6,R06_AN0810,"R06_AN0810: In past 12 months, effect of quitting/cutting back tobacco product(s",r06_an0810,"r06_an0810: in past 12 months, effect of quitting/cutting back tobacco product(s"
W6,R06_AX0006,"R06_AX0006: If you had to do it over again, would you have started using tobacco",r06_ax0006,"r06_ax0006: if you had to do it over again, would you have started using tobacco"
W6,R06_AR0141,"R06_AR0141: In past 12 months, how often have you seen a list of the chemicals c",r06_ar0141,"r06_ar0141: in past 12 months, how often have you seen a list of the chemicals c"
W6,R06_AR0142,"R06_AR0142: In past 12 months, how often have you thought about the chemicals co",r06_ar0142,"r06_ar0142: in past 12 months, how often have you thought about the chemicals co"
W6,R06_AR0095,"R06_AR0095: In past 30 days, how often have you noticed health warnings on packa",r06_ar0095,"r06_ar0095: in past 30 days, how often have you noticed health warnings on packa"
W6,R06_AR0005,"R06_AR0005: In past 30 days, how often have you noticed health warnings on cigar",r06_ar0005,"r06_ar0005: in past 30 days, how often have you noticed health warnings on cigar"
W6,R06_AR0259,"R06_AR0259: In past 30 days, how often have you talked to anyone about warning l",r06_ar0259,"r06_ar0259: in past 30 days, how often have you talked to anyone about warning l"
W6,R06_AR0202,"R06_AR0202: In past 30 days, how often have you read or looked closely at the he",r06_ar0202,"r06_ar0202: in past 30 days, how often have you read or looked closely at the he"
W6,R06_AR0015,"R06_AR0015: In past 30 days, tried to avoid looking at or thinking about the hea",r06_ar0015,"r06_ar0015: in past 30 days, tried to avoid looking at or thinking about the hea"
W6,R06_AR0025,R06_AR0025: Believability of health warnings on cigarette packs,r06_ar0025,r06_ar0025: believability of health warnings on cigarette packs
W6,R06_AR0035,R06_AR0035: Extent to which health warnings on cigarette packs make you think ab,r06_ar0035,r06_ar0035: extent to which health warnings on cigarette packs make you think ab
W6,R06_AR0110,"R06_AR0110: In past 30 days, how often noticed health warnings on packages of e-",r06_ar0110,"r06_ar0110: in past 30 days, how often noticed health warnings on packages of e-"
W6,R06_AR0222,"R06_AR0222: In past 30 days, how often you read or looked closely at the health",r06_ar0222,"r06_ar0222: in past 30 days, how often you read or looked closely at the health"
W6,R06_AR0223,"R06_AR0223: In past 30 days, how often have health warnings stopped you from usi",r06_ar0223,"r06_ar0223: in past 30 days, how often have health warnings stopped you from usi"
W6,R06_AR0224,"R06_AR0224: In past 30 days, have you tried to avoid looking at or thinking abou",r06_ar0224,"r06_ar0224: in past 30 days, have you tried to avoid looking at or thinking abou"
W6,R06_AR0263,R06_AR0263: How believable do you consider health warnings on packages of electr,r06_ar0263,r06_ar0263: how believable do you consider health warnings on packages of electr
W6,R06_AR0226,"R06_AR0226: Extent to which health warnings on packages of e-cigarettes, e-liqui",r06_ar0226,"r06_ar0226: extent to which health warnings on packages of e-cigarettes, e-liqui"
W6,R06_AR0227,R06_AR0227: To what extent do health warnings on packages of electronic nicotine,r06_ar0227,r06_ar0227: to what extent do health warnings on packages of electronic nicotine
W6,R06_AR0228,R06_AR0228: To what extent do health warnings on packages of electronic nicotine,r06_ar0228,r06_ar0228: to what extent do health warnings on packages of electronic nicotine
W6,R06_AR0115,"R06_AR0115: In past 30 days, how often noticed health warnings on packages of tr",r06_ar0115,"r06_ar0115: in past 30 days, how often noticed health warnings on packages of tr"
W6,R06_AR0229,"R06_AR0229: In past 30 days, how often you read or looked closely at the health",r06_ar0229,"r06_ar0229: in past 30 days, how often you read or looked closely at the health"
W6,R06_AR0264,"R06_AR0264: In past 30 days, how often have health warnings stopped you from hav",r06_ar0264,"r06_ar0264: in past 30 days, how often have health warnings stopped you from hav"
W6,R06_AR0231,"R06_AR0231: In past 30 days, have you tried to avoid looking at or thinking abou",r06_ar0231,"r06_ar0231: in past 30 days, have you tried to avoid looking at or thinking abou"
W6,R06_AR0232,R06_AR0232: How believable do you consider health warnings on packages of tradit,r06_ar0232,r06_ar0232: how believable do you consider health warnings on packages of tradit
W6,R06_AR0233,R06_AR0233: Extent to which health warnings on packages of traditional cigars ma,r06_ar0233,r06_ar0233: extent to which health warnings on packages of traditional cigars ma
W6,R06_AR0234,R06_AR0234: To what extent do health warnings on traditional cigars make you mor,r06_ar0234,r06_ar0234: to what extent do health warnings on traditional cigars make you mor
W6,R06_AR0235,R06_AR0235: To what extent do health warnings on traditional cigars make you les,r06_ar0235,r06_ar0235: to what extent do health warnings on traditional cigars make you les
W6,R06_AR0120,"R06_AR0120: In past 30 days, how often noticed health warnings on packages of ci",r06_ar0120,"r06_ar0120: in past 30 days, how often noticed health warnings on packages of ci"
W6,R06_AR0236,"R06_AR0236: In past 30 days, how often you read or looked closely at the health",r06_ar0236,"r06_ar0236: in past 30 days, how often you read or looked closely at the health"
W6,R06_AR0237,"R06_AR0237: In past 30 days, how often have health warnings stopped you from hav",r06_ar0237,"r06_ar0237: in past 30 days, how often have health warnings stopped you from hav"
W6,R06_AR0238,"R06_AR0238: In past 30 days, have you tried to avoid looking at or thinking abou",r06_ar0238,"r06_ar0238: in past 30 days, have you tried to avoid looking at or thinking abou"
W6,R06_AR0239,R06_AR0239: How believable do you consider health warnings on packages of cigari,r06_ar0239,r06_ar0239: how believable do you consider health warnings on packages of cigari
W6,R06_AR0240,R06_AR0240: Extent to which health warnings on packages of cigarillos make you t,r06_ar0240,r06_ar0240: extent to which health warnings on packages of cigarillos make you t
